{
  "framework_version": "0.1.1",
  "project_name": "atlas",
  "purpose": "# ATLAS AI Engineering Framework\n\n> Repository-native operating system for AI-assisted software engineering.\n> ATLAS gives Claude Code and Codex shared project memory, specialist roles,\n> repeatable workflows, governance contracts, frontend craft standards,\n> production trust and web assurance gates, and verifiable continuity.\n\n**Version:** `0.1.1`\n**Status:** Stable \u00b7 **License:** MIT\n\n[Installation](docs/installation.md) \u00b7\n[Daily Quickstart](docs/daily-quickstart.md) \u00b7\n[Agent Catalog](docs/agent-catalog.md) \u00b7\n[Skill Catalog](docs/skill-catalog.md) \u00b7\n[Operations Guide](docs/operations-guide.md) \u00b7\n[Documentation Index](docs/INDEX.md)\n\n## Who it is for\n\nAI coding sessions are productive, but projects lose quality when important\ndecisions live only in chat history, every session starts from zero, each runtime\ninterprets the project differently, technically correct frontend work collapses\ninto generic template patterns, a SaaS feature reaches production with unverified\ntrust boundaries, or a public site ships without real browser and search-facing\nevidence.\n\nATLAS keeps the operating context inside the repository so work remains portable,\nreviewable, resumable, and governed by the sam",
  "architecture": "# ATLAS Architecture Memory\n\n- **Purpose:** Preserve the stable runtime and source-of-truth architecture.\n- **Scope:** ATLAS framework repository and supported runtime adapters.\n- **Owner:** Governance steward\n- **Source of truth:** `framework/architecture.md`, `compatibility/core-contracts.json`, and runtime declarations under `adapters/`\n- **Last reviewed:** 2026-07-31\n- **Related contracts or ADRs:** `.claude/contracts/`, `framework/adr/ADR-001-separate-knowledge-from-execution.md`\n\n## Stable constraints\n\n- Claude Code is the canonical runtime and its implementation lives in\n  `.claude/`.\n- Codex is a supported compatibility runtime under `adapters/codex/`.\n- Contracts, memory, framework models, documentation, schemas, and templates\n  are shared sources; adapters translate runtime form without redefining them.\n- Canonical agent definitions live only in `.claude/agents/`.\n- Codex catalogs and machine-readable maps are generated from\n  `.claude/registry.json` and must pass drift detection.\n- Gemini and Cursor remain experimental and are not stabilization priorities.\n\n## Change triggers\n\nReview this memory when canonical paths, runtime support classification,\ncontract semantics, or adapter ownership changes.",
  "current_state": "# Changelog\n\n## Unreleased\n\n### Fixed\n\n- Discovery enforces the validated trust policy and excludes review-required,\n  denied, unknown, and missing trust labels; unsafe external allow rules fail\n  schema validation\n- Capability Fabric includes the canonical orchestrator exactly once\n- Regression tests cover trust enforcement, invalid policies, and search limits\n\n### Added\n\n- Capability Fabric with generated discovery catalogs for all registered\n  agents, skills, workflows, reviews, and commands\n- Bounded deterministic capability search with a default top-three result set\n- Deny-by-default trust policy and JSON Schemas for capability provenance,\n  admission, and discovery artifacts\n- Full-profile contract tests for catalog drift, path resolution, trust labels,\n  bounded ranking, and exact-name discovery\n\n### Changed\n\n- Quick and full validation profiles now reject stale Capability Fabric\n  artifacts\n- Canonical registry and documentation now expose the Capability Fabric model\n  without creating a second hand-maintained source of truth\n\n## 0.1.1\n\n### Added\n\n- Native Claude Code skills under `.claude/skills/*/SKILL.md` and generated\n  Codex-native wrappers under `.agents/skills/*/SKILL.md`\n- Portable `quick`, `full`, and `release` validation profiles\n- Read-only adoption planner for integrating ATLAS into existing repositories\n- Executable runtime golden path and execution-result recorder\n- Full contract-conformance reporting and strict lifecycle schema validation\n- Base-content hashes and local-customization conflict detection for\n  incremental patches\n- Schema-aware deployment receipts and audit-bundle integrity verification\n\n### Changed\n\n- All agents, skills, workflows, reviews, and commands now conform to their\n  canonical contracts\n- Task routing now covers the registered engineering domains instead of four\n  generic routes\n- Context packs and execution plans derive canonical roles, workflows, skills,\n  reviews, runtime declarations, affected paths, and acceptance criteria\n- Claude Code bootstrap now uses root `CLAUDE.md`; Codex retains `AGENTS.md`\n  and receives synchronized native skill wrappers\n- Release source enumeration honors Git ignored state and rejects symlinks\n- CI uses the portable release profile and validates native skill drift\n\n### Fixed\n\n- Canonical ADR resolution and continuity builders no longer accept fallback\n  sources or confuse templates/examples with live task state\n- Schema validators now use Draft 2020-12 with actionable JSON paths\n- Runtime validators cannot be bypassed with optimized Python\n- Incremental preflight blocks overwriting existing additions and modified or\n  missing replacement/deletion targets\n- Archive path validation rejects POSIX, Windows-drive, UNC, backslash, and\n  traversal escapes\n- Manual deployment receipts no longer claim success by default\n\n### Validation\n\n- Strict conformance reports zero violations across all registered assets\n- Full and release profiles, reproducible artifacts, clean installa",
  "active_work": [],
  "decisions": [
    "framework/adr/ADR-001-separate-knowledge-from-execution.md"
  ],
  "risks": [],
  "next_actions": [
    "Review the latest session brief.",
    "Validate memory freshness.",
    "Inspect current repository status."
  ],
  "sources": [
    "README.md",
    "CHANGELOG.md",
    ".claude/memory/",
    "docs/",
    "framework/"
  ]
}
