{
  "framework_version": "0.1.0",
  "project_name": "atlas",
  "purpose": "# ATLAS AI Engineering Framework\n\n**Version:** `0.1.0`\n**Status:** Stable\n\nATLAS is a repository-native engineering operating framework for teams that\nuse AI coding runtimes. It keeps durable project knowledge, contracts,\nspecialist responsibilities, workflows, review gates, continuity artifacts,\npolicies, and release evidence together so work can continue without depending\non chat history.\n\n## Who it is for\n\nATLAS is intended for engineers and teams that need AI-assisted work to remain\nconsistent, reviewable, portable across sessions, and compatible with more than\none runtime. It is especially useful when architecture, business constraints,\nmanual deployment, auditability, or cross-session handoff matter.\n\n## What it solves\n\n- Preserves validated knowledge in the repository.\n- Separates durable memory from temporary execution state.\n- Protects meaning through contracts, policies, tests, and review gates.\n- Routes tasks through reusable agents, skills, workflows, and commands.\n- Shares canonical knowledge between Claude Code and Codex.\n- Produces checkpoints, handoffs, resume packets, evidence, and audit bundles.\n- Builds reproducible cumulative, incremental, and recovery packages.",
  "architecture": "# ATLAS Architecture Memory\n\n- **Purpose:** Preserve the stable runtime and source-of-truth architecture.\n- **Scope:** ATLAS framework repository and supported runtime adapters.\n- **Owner:** Governance steward\n- **Source of truth:** `framework/architecture.md`, `compatibility/core-contracts.json`, and runtime declarations under `adapters/`\n- **Last reviewed:** 2026-07-31\n- **Related contracts or ADRs:** `.claude/contracts/`, `framework/adr/ADR-001-separate-knowledge-from-execution.md`\n\n## Stable constraints\n\n- Claude Code is the canonical runtime and its implementation lives in\n  `.claude/`.\n- Codex is a supported compatibility runtime under `adapters/codex/`.\n- Contracts, memory, framework models, documentation, schemas, and templates\n  are shared sources; adapters translate runtime form without redefining them.\n- Canonical agent definitions live only in `.claude/agents/`.\n- Codex catalogs and machine-readable maps are generated from\n  `.claude/registry.json` and must pass drift detection.\n- Gemini and Cursor remain experimental and are not stabilization priorities.\n\n## Change triggers\n\nReview this memory when canonical paths, runtime support classification,\ncontract semantics, or adapter ownership changes.",
  "current_state": "# Changelog\n\n## 0.1.0\n\n### Added\n\n- Stable release manifest, migration, validation, exercise evidence, and\n  reproducible distribution artifacts\n- Direct beta.11-to-stable incremental upgrade path\n\n### Changed\n\n- Version channel promoted from `0.1.0-rc.1` to stable `0.1.0`\n- Claude Code and Codex support graduated from beta-supported to supported\n- Core contract classification promoted from `stable-rc` to `stable`\n- Stable support, compatibility, deprecation, rollback, and known-limitations\n  commitments activated\n\n### Validation\n\n- Tagged RC source passed two GitHub-hosted validation runs\n- Post-RC hygiene exercise completed without blockers on the corrected source\n- Full local validation, deterministic package reproduction, beta.11 upgrade,\n  clean installation, recovery, and audit-integrity gates are required by the\n  stable checklist\n\n## 0.1.0-rc.1\n\n### Added\n\n- Release-candidate manifests, migration guidance, validation evidence, and\n  reproducible distribution artifacts\n- Explicit `rc` contract-stability classification\n\n### Changed\n\n- Version channel promoted from `0.1.0-beta.12` to `0.1.0-rc.1`\n- Core contract status promoted from `stable-beta` to `stable-rc`\n- The support matrix now documents beta-to-RC and RC-to-stable transitions\n- Release metadata now identifies the `rc` channel\n\n### Fixed\n\n- Removed user-local `.vscode/extensions.json` from version control while\n  preserving it outside release payloads\n- Corrected stale known-limitations text that classified Codex as experimental\n- Normalized release-document EOF formatting\n\n### Promotion evidence\n\n- GitHub pull request #1 merged as\n  `6f8d82dc3241a923ea0ee0f81e1e02e50b45c521`\n- GitHub-hosted CI and independent review were reported as passed before merge\n- The merge contains the finalized beta.12 source at\n  `5fa430968011216c265c05add647ff14cf1858d0`\n\n## 0.1.0-beta.12\n\n### Added\n\n- Deterministic cumulative, incremental, and recovery release builders\n- Package integrity manifests, checksums, validators, and install simulators\n- Centralized version-source management with historical-artifact protection\n- Schema validation with positive fixtures for every registered schema\n- Generated Codex maps for agents, commands, skills, workflows, and reviews\n- Runtime lifecycle end-to-end coverage, including continuity, conflicts,\n  reconciliation, evidence, deployment receipts, and audit integrity\n- Executable release, runtime, schema, CI, support, source-of-truth, package,\n  deletion, and repository-cleanliness policies\n- Durable architecture, business, operations, and contradiction memories\n- Memory freshness, knowledge-link, documentation, and exception validators\n- Release candidate and stable release checklists\n- Complete installation, runtime, deployment, release, and troubleshooting\n  documentation\n\n### Changed\n\n- Canonical agent definitions now live exclusively under `.claude/agents/`\n- Codex is beta-supported with generated, resolvable parity maps\n- CI installs explicit test dependencies a",
  "active_work": [],
  "decisions": [
    ".claude/skills/architecture/adr-authoring.md",
    "examples/adr/ADR-002-example-service-boundary.md",
    "framework/adr/ADR-001-separate-knowledge-from-execution.md",
    "templates/adr-template.md"
  ],
  "risks": [],
  "next_actions": [
    "Review the latest session brief.",
    "Validate memory freshness.",
    "Inspect current repository status."
  ],
  "sources": [
    "README.md",
    "CHANGELOG.md",
    ".claude/memory/",
    "docs/",
    "framework/"
  ]
}
